{
  "contract": "store-layout-v1",
  "delivery": "proposed_plan",
  "planId": "cafe-example-01",
  "title": "12m 카페 배치 초안",
  "status": "blocked",
  "baseline": {
    "worldId": "example-store-v1",
    "revision": 0,
    "source": "illustrative_fixture"
  },
  "grid": {
    "originM": [
      0,
      0,
      0
    ],
    "originAlignment": "cell_center",
    "tileSizeM": 4,
    "objectSnapM": 1,
    "heightStepM": 1
  },
  "region": {
    "minXZ": [
      -2,
      -2
    ],
    "maxXZ": [
      10,
      10
    ],
    "layoutAnchorCell": {
      "x": 0,
      "z": 0
    }
  },
  "tiles": [
    {
      "tileId": "cafe-floor-0-0",
      "action": "install",
      "cell": {
        "x": 0,
        "z": 0,
        "level": 0
      },
      "centerM": [
        0,
        0,
        0
      ],
      "sizeCells": 1,
      "shape": "box",
      "surfaceMode": "engine_base",
      "topY": 0,
      "baseY": -0.04,
      "thicknessM": 0.04,
      "floorPresetId": "oak-planks"
    },
    {
      "tileId": "cafe-floor-1-0",
      "action": "install",
      "cell": {
        "x": 1,
        "z": 0,
        "level": 0
      },
      "centerM": [
        4,
        0,
        0
      ],
      "sizeCells": 1,
      "shape": "box",
      "surfaceMode": "engine_base",
      "topY": 0,
      "baseY": -0.04,
      "thicknessM": 0.04,
      "floorPresetId": "oak-planks"
    },
    {
      "tileId": "cafe-floor-2-0",
      "action": "install",
      "cell": {
        "x": 2,
        "z": 0,
        "level": 0
      },
      "centerM": [
        8,
        0,
        0
      ],
      "sizeCells": 1,
      "shape": "box",
      "surfaceMode": "engine_base",
      "topY": 0,
      "baseY": -0.04,
      "thicknessM": 0.04,
      "floorPresetId": "oak-planks"
    },
    {
      "tileId": "cafe-floor-0-1",
      "action": "install",
      "cell": {
        "x": 0,
        "z": 1,
        "level": 0
      },
      "centerM": [
        0,
        0,
        4
      ],
      "sizeCells": 1,
      "shape": "box",
      "surfaceMode": "engine_base",
      "topY": 0,
      "baseY": -0.04,
      "thicknessM": 0.04,
      "floorPresetId": "oak-planks"
    },
    {
      "tileId": "cafe-floor-1-1",
      "action": "install",
      "cell": {
        "x": 1,
        "z": 1,
        "level": 0
      },
      "centerM": [
        4,
        0,
        4
      ],
      "sizeCells": 1,
      "shape": "box",
      "surfaceMode": "engine_base",
      "topY": 0,
      "baseY": -0.04,
      "thicknessM": 0.04,
      "floorPresetId": "oak-planks"
    },
    {
      "tileId": "cafe-floor-2-1",
      "action": "install",
      "cell": {
        "x": 2,
        "z": 1,
        "level": 0
      },
      "centerM": [
        8,
        0,
        4
      ],
      "sizeCells": 1,
      "shape": "box",
      "surfaceMode": "engine_base",
      "topY": 0,
      "baseY": -0.04,
      "thicknessM": 0.04,
      "floorPresetId": "oak-planks"
    },
    {
      "tileId": "cafe-floor-0-2",
      "action": "install",
      "cell": {
        "x": 0,
        "z": 2,
        "level": 0
      },
      "centerM": [
        0,
        0,
        8
      ],
      "sizeCells": 1,
      "shape": "box",
      "surfaceMode": "engine_base",
      "topY": 0,
      "baseY": -0.04,
      "thicknessM": 0.04,
      "floorPresetId": "oak-planks"
    },
    {
      "tileId": "cafe-floor-1-2",
      "action": "install",
      "cell": {
        "x": 1,
        "z": 2,
        "level": 0
      },
      "centerM": [
        4,
        0,
        8
      ],
      "sizeCells": 1,
      "shape": "box",
      "surfaceMode": "engine_base",
      "topY": 0,
      "baseY": -0.04,
      "thicknessM": 0.04,
      "floorPresetId": "oak-planks"
    },
    {
      "tileId": "cafe-floor-2-2",
      "action": "install",
      "cell": {
        "x": 2,
        "z": 2,
        "level": 0
      },
      "centerM": [
        8,
        0,
        8
      ],
      "sizeCells": 1,
      "shape": "box",
      "surfaceMode": "engine_base",
      "topY": 0,
      "baseY": -0.04,
      "thicknessM": 0.04,
      "floorPresetId": "oak-planks"
    }
  ],
  "walls": [
    {
      "wallId": "cafe-north-0",
      "tileId": "cafe-floor-0-0",
      "edge": "north",
      "kind": "solid",
      "wallPresetId": "shopfront",
      "heightM": 4,
      "thicknessM": 0.5
    },
    {
      "wallId": "cafe-south-0",
      "tileId": "cafe-floor-0-2",
      "edge": "south",
      "kind": "solid",
      "wallPresetId": "shopfront",
      "heightM": 4,
      "thicknessM": 0.5
    },
    {
      "wallId": "cafe-north-1",
      "tileId": "cafe-floor-1-0",
      "edge": "north",
      "kind": "window",
      "wallPresetId": "shopfront",
      "heightM": 4,
      "thicknessM": 0.5
    },
    {
      "wallId": "cafe-south-1",
      "tileId": "cafe-floor-1-2",
      "edge": "south",
      "kind": "door",
      "wallPresetId": "shopfront",
      "heightM": 4,
      "thicknessM": 0.5
    },
    {
      "wallId": "cafe-north-2",
      "tileId": "cafe-floor-2-0",
      "edge": "north",
      "kind": "solid",
      "wallPresetId": "shopfront",
      "heightM": 4,
      "thicknessM": 0.5
    },
    {
      "wallId": "cafe-south-2",
      "tileId": "cafe-floor-2-2",
      "edge": "south",
      "kind": "solid",
      "wallPresetId": "shopfront",
      "heightM": 4,
      "thicknessM": 0.5
    },
    {
      "wallId": "cafe-west-0",
      "tileId": "cafe-floor-0-0",
      "edge": "west",
      "kind": "solid",
      "wallPresetId": "shopfront",
      "heightM": 4,
      "thicknessM": 0.5
    },
    {
      "wallId": "cafe-east-0",
      "tileId": "cafe-floor-2-0",
      "edge": "east",
      "kind": "solid",
      "wallPresetId": "shopfront",
      "heightM": 4,
      "thicknessM": 0.5
    },
    {
      "wallId": "cafe-west-1",
      "tileId": "cafe-floor-0-1",
      "edge": "west",
      "kind": "solid",
      "wallPresetId": "shopfront",
      "heightM": 4,
      "thicknessM": 0.5
    },
    {
      "wallId": "cafe-east-1",
      "tileId": "cafe-floor-2-1",
      "edge": "east",
      "kind": "solid",
      "wallPresetId": "shopfront",
      "heightM": 4,
      "thicknessM": 0.5
    },
    {
      "wallId": "cafe-west-2",
      "tileId": "cafe-floor-0-2",
      "edge": "west",
      "kind": "solid",
      "wallPresetId": "shopfront",
      "heightM": 4,
      "thicknessM": 0.5
    },
    {
      "wallId": "cafe-east-2",
      "tileId": "cafe-floor-2-2",
      "edge": "east",
      "kind": "solid",
      "wallPresetId": "shopfront",
      "heightM": 4,
      "thicknessM": 0.5
    }
  ],
  "objects": [
    {
      "objectId": "cafe-table",
      "catalogId": "table-basic",
      "tileId": "cafe-floor-0-0",
      "positionM": [
        0,
        0,
        2
      ],
      "rotationDeg": 90,
      "sizeFactor": 1,
      "footprintM": [
        [
          -1.251102,
          2.638236
        ],
        [
          -1.251102,
          1.361764
        ],
        [
          1.251101,
          1.361764
        ],
        [
          1.251101,
          2.638236
        ]
      ],
      "placementRole": "좌석 테이블"
    },
    {
      "objectId": "cafe-chair-north",
      "catalogId": "chair-basic",
      "tileId": "cafe-floor-0-0",
      "positionM": [
        0,
        0,
        0
      ],
      "rotationDeg": 0,
      "sizeFactor": 1,
      "footprintM": [
        [
          -0.530785,
          -0.451335
        ],
        [
          0.533885,
          -0.451335
        ],
        [
          0.533885,
          0.483568
        ],
        [
          -0.530785,
          0.483568
        ]
      ],
      "placementRole": "북쪽 좌석"
    },
    {
      "objectId": "cafe-chair-south",
      "catalogId": "chair-basic",
      "tileId": "cafe-floor-0-1",
      "positionM": [
        0,
        0,
        4
      ],
      "rotationDeg": 180,
      "sizeFactor": 1,
      "footprintM": [
        [
          0.530785,
          4.451335
        ],
        [
          -0.533885,
          4.451335
        ],
        [
          -0.533885,
          3.516432
        ],
        [
          0.530785,
          3.516432
        ]
      ],
      "placementRole": "남쪽 좌석"
    },
    {
      "objectId": "cafe-counter",
      "catalogId": "shop-stall-basic",
      "tileId": "cafe-floor-2-0",
      "positionM": [
        8,
        0,
        0
      ],
      "rotationDeg": 90,
      "sizeFactor": 1,
      "footprintM": [
        [
          6.845765,
          0.602756
        ],
        [
          6.845765,
          -0.431588
        ],
        [
          9.154235,
          -0.431588
        ],
        [
          9.154235,
          0.602756
        ]
      ],
      "placementRole": "카운터 역할 가판대"
    },
    {
      "objectId": "cafe-lamp",
      "catalogId": "lamp-basic",
      "tileId": "cafe-floor-2-2",
      "positionM": [
        8,
        0,
        8
      ],
      "rotationDeg": 0,
      "sizeFactor": 1,
      "footprintM": [
        [
          7.765034,
          7.75294
        ],
        [
          8.234966,
          7.75294
        ],
        [
          8.234966,
          8.247056
        ],
        [
          7.765034,
          8.247056
        ]
      ],
      "placementRole": "조명"
    }
  ],
  "entrances": [
    {
      "entranceId": "cafe-entry",
      "wallId": "cafe-south-1",
      "clearOpeningWidthM": 2.08,
      "outsidePointXZ": [
        4,
        11
      ],
      "insidePointXZ": [
        4,
        8
      ]
    }
  ],
  "circulation": {
    "minClearWidthM": 1.5,
    "safetyMarginM": 0.15,
    "avatarCapsuleDiameterM": 0.6,
    "paths": [
      {
        "pathId": "entry-main",
        "entranceId": "cafe-entry",
        "targetObjectIds": [
          "cafe-counter"
        ],
        "pointsXZ": [
          [
            4,
            10
          ],
          [
            4,
            0
          ],
          [
            6,
            0
          ]
        ],
        "clearWidthM": 1.5,
        "cap": "butt"